state,product_description,address_1,city,status,lat,lon
AL,Irvington Seafood Crabmeat,11125 Beverly Rd,Irvington,Completed,30.4596,-88.249194
AL,Port City Soups  Tex-Mex Chili,10 Springdale Blvd,Mobile,Terminated,30.68766194,-88.1238764
AL,Port City Soups  Alkaline Vegetable Soup,10 Springdale Blvd,Mobile,Terminated,30.68766194,-88.1238764
AL,Port City Soups  Creole Gumbo,10 Springdale Blvd,Mobile,Terminated,30.68766194,-88.1238764
AL,Port City Soups  Baton Rouge Beans,10 Springdale Blvd,Mobile,Terminated,30.68766194,-88.1238764